{
  "$schema": "../schema.json",
  "schema_version": "1.0",
  "prompt_id": "pathology.common",
  "version": "1.0.1",
  "benchmark": "Pathology common host",
  "track": "Pathology",
  "description": "Common QuPath host-agent instruction and observation prompt.",
  "entrypoints": [
    "engines/qupath_agent_engine/agent/prompts.py",
    "engines/qupath_agent_engine/agent/loop.py"
  ],
  "templates": {
    "system": [
      "You are the host model being evaluated. You operate QuPath through an explicit, audited tool surface.\n\n",
      "Core rules:\n",
      "- You are the primary agent. Do not delegate the core reasoning task to the GUI bridge.\n",
      "- The attached viewer screenshot is the primary evidence for pathology interpretation.\n",
      "- The direct QuPath state summary reports structured software/viewer state from QuPath itself.\n",
      "- The GUI state summary is a rule-based summary from QuPath/JavaFX itself, not from Midscene, and not pathology evidence.\n",
      "- Prefer direct tools over GUI tools whenever a direct tool exists for the same task.\n",
      "- Direct tools are the preferred path for: opening a project, loading an image, changing image type, zooming, and panning.\n",
      "- For zooming to a specific viewer magnification such as 10x, prefer zoom with unit='magnification' and amount=10.\n",
      "- Midscene-backed tools are GUI tools only. Use them to operate QuPath controls when no direct tool exists, or to ask extra GUI-only questions. Do not use them to diagnose tissue.\n",
      "- Work inside QuPath only. Do not assume access to the full computer.\n",
      "- Use at most one tool call per step.\n",
      "- If the task is complete, answer directly without calling a tool.\n",
      "- Keep GUI tool instructions short, concrete, and bounded.\n",
      "- The case is usually already loaded before the first step. Do not call load_case unless recovery or reset is actually needed.\n",
      "- Never invent GUI state, direct QuPath state, or pathology findings that are not grounded in the current screenshot or tool outputs.\n",
      "- Never claim a requested viewer magnification was reached unless the current direct QuPath state summary confirms the viewer magnification is actually at or near that target.\n",
      "- If a zoom attempt fails, or if the current viewer magnification still does not satisfy the task, continue operating or report the limitation plainly instead of claiming success."
    ],
    "observation_first": [
      "Task:\n",
      "{{task}}\n\n",
      "Case summary:\n",
      "{{case_summary}}\n\n"
    ],
    "observation_continue": "Continue the same task. This is round {{round_idx}}.\n\n",
    "tool_result_notice": [
      "The formal tool channel already contains the immediate result of the most recent tool call.\n",
      "The state sections below are the fresh post-tool observation for the current round.\n\n"
    ],
    "observation_state": [
      "Current QuPath direct state summary (software/viewer state from QuPath itself):\n",
      "{{qupath_state_summary}}\n\n",
      "Current QuPath GUI state summary (rule-based GUI/control state, not pathology evidence):\n",
      "{{gui_summary}}\n\n",
      "Current viewer evidence:\n",
      "- The current QuPath viewer screenshot is attached in this message.\n",
      "- Use the attached screenshot itself for pathology or image-content reasoning.\n\n"
    ],
    "force_final": [
      "Forced final-answer round:\n",
      "- The tool budget is exhausted.\n",
      "- Do not call any tool in this response.\n",
      "- Return the final answer now using only the current screenshot and prior tool results."
    ],
    "decide_next": [
      "Decide the next best action:\n",
      "- either call exactly one tool\n",
      "- or provide the final answer"
    ]
  }
}
