{
  "$schema": "../schema.json",
  "schema_version": "1.0",
  "prompt_id": "pathology.bracs",
  "version": "1.0.1",
  "benchmark": "BRACS",
  "track": "Pathology",
  "description": "Viewer-native breast whole-slide classification and localization prompt.",
  "entrypoints": [
    "pathology/benchmarks/benchmark_bracs.py"
  ],
  "templates": {
    "system_extra": [
      "Benchmark-specific rules:\n",
      "- This is a blinded pathology benchmark. The image is already loaded before the first model step.\n",
      "- Do not ask for file paths, project names, hidden annotations, or dataset metadata.\n",
      "- Use the viewer screenshot for pathology reasoning.\n",
      "- If your final slide-level label is not N, localize one or more ROI points by calling viewer_point_to_wsi_coordinate on the current viewer screenshot.\n",
      "- The conversion tool expects x and y in the range 0..999, measured on the CURRENT viewer screenshot, with origin at the top-left.\n",
      "- The conversion tool returns full-resolution QuPath/WSI image coordinates. Use those returned coordinates in the final answer.\n",
      "- Do not output any coordinates when your final slide-level label is N.\n",
      "- You may output multiple coordinates when multiple ROIs support the answer.\n",
      "- Choose points on the main tissue image, not on the overview thumbnail, scale bar, or text overlays.\n",
      "- If you are uncertain, state the uncertainty plainly. Do not invent findings.\n",
      "- Your final response must be JSON only."
    ],
    "case_summary": [
      "Case alias: {{case_alias}}\n",
      "A blinded breast H&E whole-slide image is already loaded in QuPath.\n",
      "Ground-truth annotations are hidden from you.\n",
      "You must determine the single best slide-level BRACS label and, when non-negative, support it with one or more WSI coordinate localizations."
    ],
    "task": [
      "You are evaluating a blinded breast H&E whole-slide image in QuPath.\n\n",
      "Primary task:\n",
      "Choose the single best slide-level BRACS label from the following options:\n",
      "{{options}}\n\n",
      "Important rules:\n",
      "- The image is already loaded in QuPath.\n",
      "- Ground-truth annotations are hidden from you.\n",
      "- You may navigate freely in QuPath.\n",
      "- If your final slide-level label is N, localizations must be an empty list.\n",
      "- If your final slide-level label is not N, output one or more ROI coordinates in full-resolution WSI image pixels.\n",
      "- To obtain a coordinate, call viewer_point_to_wsi_coordinate with x and y in 0..999 on the CURRENT viewer screenshot, measured from the top-left corner.\n",
      "- Use the x and y returned by that tool in the final answer.\n",
      "- You may output multiple coordinates when multiple ROIs support the diagnosis.\n",
      "- Choose points on the main tissue image, not on the overview thumbnail, scale bar, or text overlays.\n",
      "- wsi_label must be exactly one of: {{allowed_labels}}.\n",
      "- If you are uncertain, state the uncertainty plainly. Do not invent findings.\n\n",
      "Final answer format:\n",
      "Return JSON only, with exactly these keys:\n",
      "{\n",
      "  \"selected_option\": \"A|B|C|D|E|F|G\",\n",
      "  \"wsi_label\": \"N|PB|UDH|FEA|ADH|DCIS|IC\",\n",
      "  \"confidence\": 0.0,\n",
      "  \"brief_rationale\": \"...\",\n",
      "  \"localizations\": [{\"x\": 0.0, \"y\": 0.0}]\n",
      "}"
    ]
  }
}
